{
  "$schema": "ops/schemas/outcome-metrics.schema.json",
  "artifact_kind": "outcome_metrics_report",
  "generated_at": "2026-05-20T08:51:50Z",
  "producer": "ops.scripts.observability_decision_metrics_runtime",
  "source_command": "python -m ops.scripts.outcome_metrics --vault . --policy-path ops/policies/wiki-maintainer-policy.yaml",
  "source_revision": "unknown",
  "source_tree_fingerprint": "0e14298ef90444462a87ace241d6ab035cc99f34f352eb00d49ec9b32a0854c4",
  "input_fingerprints": {
    "policy": "9d4ebed9b08cd4c9340a88a7d8cfefe17e2a46f7e63711418e4d6057f5b967d3",
    "schema": "aadbf232f7dc6bf40f35290f0dabcc4e9320b93c70cc2f0177f1167b24ecff29",
    "artifact_envelope_schema": "87fcb7b91ffc04e8180c1c3e51e309cde186ecf23f91f7974a541d0b580976de",
    "source_paths": "c364e1ed667cd810b07ae3d6b09e9de4431804a8db70852d444664e6939e289d",
    "defect_escape_closures": "cefd893320a733da69c34eb5a55e92ee1c88475952ebe35db8788284714cbb82",
    "rework_closures": "330a3dc74be9abbeb429578369920572d94f20e38b1bbae93ac21f487bbdcd61",
    "run_inputs": "849d6df55b27bac21e2f5aeb30024fba70b240da46d4605444754b24ccddfa01",
    "session_reports": "c6c723a041277de609fceea4c1d7f2cf848c193f829366f73885deff6506c0ff",
    "recent_window": "f5ca38f748a1d6eaf726b8a42fb575c3c71f1864a8143301782de13da2d9202b"
  },
  "schema_version": 1,
  "artifact_status": "current",
  "retention_policy": "canonical_report",
  "encoding": "utf-8",
  "currentness": {
    "status": "current",
    "checked_at": "2026-05-20T08:51:50Z"
  },
  "vault": ".",
  "policy": {
    "path": "ops/policies/wiki-maintainer-policy.yaml",
    "version": 4
  },
  "summary": {
    "attempts_considered": 18,
    "recent_window": 20,
    "recent_attempt_count": 18,
    "session_reports_considered": 8
  },
  "metrics": {
    "attempt_count": 18,
    "recent_window": 20,
    "recent_attempt_count": 18,
    "rework_count": 2,
    "rollback_signal_count": 0,
    "rollback_rehearsal_coverage_count": 3,
    "moving_averages": {
      "hold": 0.3889,
      "discard": 0.2222,
      "rollback_signal": 0.0
    },
    "operator_effort_proxy": {
      "phase_totals_seconds": {
        "scope_freeze": 0.059,
        "routing": 2.91,
        "scaffold": 2.513,
        "experiment": 4570.857,
        "typed_same_eval_evidence": 0.0
      },
      "executor_report_count": 7,
      "reviewer_dispatch_count": 2,
      "validator_dispatch_count": 1,
      "auditor_dispatch_count": 1,
      "hold_count": 7
    },
    "rework_keys": [
      {
        "key": "proposal:recent_log_overlap_queue_blocked__mechanism-run-validation-runtime",
        "attempt_count": 3,
        "rework_count": 2,
        "run_ids": [
          "5day-auto-improve-runtime-rerun6-30m_trial-run-01-mechanism-run-validation-runtime",
          "5day-auto-improve-runtime-rerun8-30m_trial-run-01-mechanism-run-validation-runtime",
          "5day-auto-improve-runtime-rerun9-30m_trial-run-01-mechanism-run-validation-runtime"
        ]
      }
    ],
    "defect_escape_proxy": {
      "count": 0,
      "pairs": [],
      "closed_count": 4,
      "closed_pairs": [
        {
          "target": "ops/scripts/auto_improve_iteration_persistence_runtime.py",
          "promoted_run_id": "run-20260422-auto-improve-timeout-telemetry-fallback",
          "escaped_run_id": "run-20260422-auto-improve-decision-record-fallback-retry2",
          "escaped_decision": "HOLD",
          "escaped_outcome": "hold",
          "closure_status": "superseded",
          "closure_reason": "Superseded by later finalized same-target runs that preserve timeout/decision telemetry and avoid HOLD/DISCARD with candidate_eval non-regression.",
          "superseding_run_id": "run-20260507-auto-improve-iteration-persistence-discard-path",
          "closed_at": "2026-05-07T04:00:00Z",
          "evidence_refs": [
            "runs/run-20260507-auto-improve-existing-telemetry-inline-same-eval-replacement/promotion-report.json",
            "runs/run-20260507-auto-improve-iteration-persistence-discard-path/promotion-report.json",
            "runs/run-20260507-auto-improve-iteration-persistence-discard-path/run-telemetry.json"
          ]
        },
        {
          "target": "ops/scripts/auto_improve_iteration_persistence_runtime.py",
          "promoted_run_id": "run-20260422-auto-improve-timeout-telemetry-fallback",
          "escaped_run_id": "run-20260422-auto-improve-decision-record-fallback-retry3-linux-tmp",
          "escaped_decision": "DISCARD",
          "escaped_outcome": "discarded",
          "closure_status": "superseded",
          "closure_reason": "Superseded by the DISCARD-path follow-up run, which finalized PROMOTE with candidate_eval non-regression, terminal decision provenance, and structural secondary improvement.",
          "superseding_run_id": "run-20260507-auto-improve-iteration-persistence-discard-path",
          "closed_at": "2026-05-07T04:00:00Z",
          "evidence_refs": [
            "runs/run-20260507-auto-improve-iteration-persistence-discard-path/promotion-report.json",
            "runs/run-20260507-auto-improve-iteration-persistence-discard-path/changed-files-manifest.json",
            "runs/run-20260507-auto-improve-iteration-persistence-discard-path/run-telemetry.json"
          ]
        },
        {
          "target": "ops/scripts/auto_improve_iteration_persistence_runtime.py",
          "promoted_run_id": "run-20260422-auto-improve-timeout-telemetry-fallback",
          "escaped_run_id": "auto-improve-2026-05-02t03-27-31z-run-01-auto-improve-iteration-persistence-runtime",
          "escaped_decision": "HOLD",
          "escaped_outcome": "scope_blocked",
          "closure_status": "superseded",
          "closure_reason": "Superseded by complete finalized same-target runs; the escaped run is archived as incomplete and missing required mechanism inputs.",
          "superseding_run_id": "run-20260507-auto-improve-iteration-persistence-discard-path",
          "closed_at": "2026-05-07T04:00:00Z",
          "evidence_refs": [
            "runs/run-20260507-auto-improve-iteration-persistence-discard-path/promotion-report.json",
            "ops/reports/mechanism-review-candidates.json"
          ]
        },
        {
          "target": "ops/scripts/auto_improve_iteration_persistence_runtime.py",
          "promoted_run_id": "run-20260507-auto-improve-existing-telemetry-inline-same-eval-replacement",
          "escaped_run_id": "run-20260507-auto-improve-iteration-persistence-typed-same-eval",
          "escaped_decision": "DISCARD",
          "escaped_outcome": "discarded",
          "closure_status": "superseded",
          "closure_reason": "Superseded by the next finalized same-target DISCARD-path run, which avoided DISCARD and recorded terminal decision provenance.",
          "superseding_run_id": "run-20260507-auto-improve-iteration-persistence-discard-path",
          "closed_at": "2026-05-07T04:00:00Z",
          "evidence_refs": [
            "runs/run-20260507-auto-improve-iteration-persistence-discard-path/promotion-report.json",
            "runs/run-20260507-auto-improve-iteration-persistence-discard-path/run-telemetry.json",
            "runs/run-20260507-auto-improve-iteration-persistence-discard-path/improvement-observations.json"
          ]
        }
      ]
    },
    "raw_rework_count": 8,
    "closed_rework_count": 6,
    "closed_rework_keys": [
      {
        "key": "proposal:repeated_same_eval_or_discard__auto-improve-iteration-persistence-runtime",
        "raw_attempt_count": 2,
        "raw_rework_count": 1,
        "run_ids": [
          "auto-improve-2026-05-02t03-27-31z-run-01-auto-improve-iteration-persistence-runtime",
          "run-20260507-auto-improve-iteration-persistence-typed-same-eval"
        ],
        "active_attempt_count": 0,
        "active_run_ids": [],
        "active_rework_count": 0,
        "closed_run_ids": [
          "auto-improve-2026-05-02t03-27-31z-run-01-auto-improve-iteration-persistence-runtime",
          "run-20260507-auto-improve-iteration-persistence-typed-same-eval"
        ],
        "closed_rework_count": 1,
        "closure_status": "superseded",
        "closure_reason": "Superseded by the later finalized DISCARD-path mechanism run that avoided DISCARD and recorded typed same-eval non-regression evidence.",
        "superseding_run_id": "run-20260507-auto-improve-iteration-persistence-discard-path",
        "closed_at": "2026-05-07T05:00:00Z",
        "evidence_refs": [
          "runs/run-20260507-auto-improve-iteration-persistence-discard-path/promotion-report.json",
          "runs/run-20260507-auto-improve-iteration-persistence-discard-path/run-telemetry.json",
          "runs/run-20260507-auto-improve-iteration-persistence-discard-path/behavior-delta.json"
        ]
      },
      {
        "key": "targets:ops/scripts/auto_improve_iteration_persistence_runtime.py",
        "raw_attempt_count": 6,
        "raw_rework_count": 5,
        "run_ids": [
          "run-20260422-auto-improve-timeout-telemetry-fallback",
          "run-20260422-auto-improve-decision-record-fallback-retry",
          "run-20260422-auto-improve-decision-record-fallback-retry2",
          "run-20260422-auto-improve-decision-record-fallback-retry3-linux-tmp",
          "run-20260507-auto-improve-existing-telemetry-inline-same-eval-replacement",
          "run-20260507-auto-improve-iteration-persistence-discard-path"
        ],
        "active_attempt_count": 0,
        "active_run_ids": [],
        "active_rework_count": 0,
        "closed_run_ids": [
          "run-20260422-auto-improve-timeout-telemetry-fallback",
          "run-20260422-auto-improve-decision-record-fallback-retry",
          "run-20260422-auto-improve-decision-record-fallback-retry2",
          "run-20260422-auto-improve-decision-record-fallback-retry3-linux-tmp",
          "run-20260507-auto-improve-existing-telemetry-inline-same-eval-replacement",